<?xml version="1.0" encoding="UTF-8" ?>
<quests xmlns="http://angelis.com/quests" xmlns:xsi="http://www.w3.org/2001/XMLSchema-instance" xsi:schemaLocation="http://angelis.com/quests ../../../../schema/quests.xsd ">
	<!-- jenova-project-tera QuestCreator, Created By TheNak -->
	<quest quest_id="1322" quest_type="NORMAL" start_npc_full_id="21301003" required_level="1" experience_reward="500 " money_reward="0" reward_type="SELECTABLE">
		<step type="KILL">
			<step_value object_id="130300931" amount="5"/>
		</step>
		<step type="TALK">
			<step_value object_id="21301003"/>
		</step>
		<reward item_id="17703" amount="1"/>
		<reward item_id="17706" amount="1"/>
		<reward item_id="17709" amount="1"/>
	</quest>
	<quest quest_id="1302" quest_type="NORMAL" start_npc_full_id="21301014" required_level="1" experience_reward="400" money_reward="40">
		<step type="TALK">
			<step_value object_id="21301106"/>
		</step>
	</quest>
	<quest quest_id="1321" quest_type="NORMAL" start_npc_full_id="21301106" required_level="1" experience_reward="800" money_reward="80">
		<step type="TALK">
			<step_value object_id="21301003"/>
		</step>
	</quest>
	<quest quest_id="1322" quest_type="NORMAL" start_npc_full_id="21301003" required_level="1" experience_reward="500" money_reward="0" reward_type="SELECTABLE">
		<step type="KILL">
			<step_value object_id="130300931" amount="5"/>
		</step>
		<step type="TALK">
			<step_value object_id="21301003"/>
		</step>
		<reward item_id="17703" amount="1"/>
		<reward item_id="17706" amount="1"/>
		<reward item_id="17709" amount="1"/>
	</quest>
	<quest quest_id="1323" quest_type="NORMAL" start_npc_full_id="21301003" required_level="1" experience_reward="800" money_reward="80" reward_type="SELECTABLE">
		<step type="KILL">
			<step_value object_id="130300931" amount="5"/>
		</step>
		<step type="TALK">
			<step_value object_id="21301017"/>
		</step>
		<reward item_id="10009" amount="1"/>
		<reward item_id="10010" amount="1"/>
		<reward item_id="10011" amount="1"/>
		<reward item_id="10012" amount="1"/>
		<reward item_id="10013" amount="1"/>
		<reward item_id="10014" amount="1"/>
		<reward item_id="10015" amount="1"/>
		<reward item_id="10016" amount="1"/>
	</quest>
</quests>